{
  "category": "Facility & Sector Guides",
  "category_slug": "facility-guides",
  "wordpress_status": "draft",
  "license": "CC BY 4.0",
  "attribution": "Alle's ClinX Open Knowledge",
  "article_id": "ACX-KB-0288",
  "slug": "soil-load-industrial-cleaning",
  "subcategory": "Industrial Facilities",
  "subcategory_slug": "industrial",
  "related_article_ids": [
    "ACX-KB-0287",
    "ACX-KB-0252",
    "ACX-KB-0268",
    "ACX-KB-0270"
  ],
  "locale": "en",
  "language": "English",
  "editorial_status": "review",
  "translation_status": "source",
  "title": "How Soil Load Affects Industrial Cleaning",
  "excerpt": "Industrial cleaning methods, frequency and resources should reflect the amount, type and rate of soil generated by the process rather than relying on a fixed housekeeping routine.",
  "seo_title": "How Soil Load Affects Industrial Cleaning | Alle's ClinX",
  "meta_description": "Learn how soil type, quantity and accumulation rate affect industrial cleaning frequency, method selection, equipment and resource planning.",
  "content_html": "<p>Soil load is the amount and type of contamination that accumulates in an area over time. In industrial environments, soil load can vary significantly between zones because production processes, material handling, traffic and maintenance activities generate different residues. Cleaning plans should reflect that variation.</p>\n<h2 id=\"type\">Soil type affects the cleaning method</h2><p>Dust, oils, grease, metal fines, food residues, powders and other process soils do not respond to the same cleaning approach. Product, equipment and method should be selected for the material being removed and the surface being cleaned.</p>\n<h2 id=\"rate\">Accumulation rate affects frequency</h2><p>Areas that re-soil quickly may need more frequent cleaning or condition-based service, while low-generation areas can often remain on a lower-frequency schedule.</p>\n<h2 id=\"quantity\">Heavy soil can change task design</h2><p>High soil loads may require pre-removal, mechanical recovery, multiple passes, larger waste capacity or additional time before final cleaning can be completed effectively.</p>\n<h2 id=\"safety\">Soil can introduce safety hazards</h2><p>Accumulated dust, liquids or residues may create slip, visibility, contamination or process hazards. Cleaning priorities should account for safety as well as appearance.</p>\n<h2 id=\"source-control\">Source control reduces cleaning demand</h2><p>Improved containment, extraction, drip control, transfer methods or maintenance can reduce how much soil reaches floors and work areas in the first place.</p>\n<h2 id=\"measure\">Measure recurring soil patterns</h2><p>Inspection findings, cleaning time, waste volume and repeat-task data can help identify where soil load is driving excessive labour or product use.</p>\n<h2 id=\"takeaway\">Practical takeaway</h2><p>Industrial cleaning should respond to actual soil type, quantity and accumulation rate. The cleaner the process controls the source, the easier the housekeeping system becomes to manage.</p>\n<h2 id=\"references\">References</h2><ol><li><a href=\"https://www.osha.gov/laws-regs/regulations/standardnumber/1910/1910.22\">OSHA — Walking-Working Surfaces</a>.</li></ol>"
}
