{
  "category": "Facility Hygiene Management",
  "category_slug": "facility-hygiene-management",
  "wordpress_status": "draft",
  "license": "CC BY 4.0",
  "attribution": "Alle's ClinX Open Knowledge",
  "article_id": "ACX-KB-0264",
  "slug": "non-conformance-vs-corrective-action",
  "subcategory": "Audits & CAPA",
  "subcategory_slug": "audits-capa",
  "related_article_ids": [
    "ACX-KB-0262",
    "ACX-KB-0263",
    "ACX-KB-0259"
  ],
  "locale": "en",
  "language": "English",
  "editorial_status": "review",
  "translation_status": "source",
  "title": "Non-Conformance vs Corrective Action: Key Differences",
  "excerpt": "A non-conformance is a failure to meet a requirement; corrective action is the structured response used to address the cause and reduce the chance of recurrence.",
  "seo_title": "Non-Conformance vs Corrective Action | Alle's ClinX",
  "meta_description": "Understand the difference between a hygiene non-conformance, immediate correction and corrective action.",
  "content_html": "<p>Non-conformance and corrective action are related but different concepts. A non-conformance describes the problem: a requirement was not met. Corrective action describes what the organization does to address the cause and reduce recurrence.</p>\n<h2 id=\"nc\">A non-conformance is a finding</h2><p>Examples include missed required cleaning, use of an unapproved product, incomplete training records or failure to follow a controlled procedure.</p>\n<h2 id=\"correction\">Correction fixes the immediate condition</h2><p>Re-cleaning an area, replacing a damaged tool or completing a missing record may correct the immediate issue without addressing why it happened.</p>\n<h2 id=\"ca\">Corrective action addresses the cause</h2><p>Corrective action may involve revising a process, improving training, changing responsibilities, fixing equipment or strengthening monitoring.</p>\n<h2 id=\"evidence\">The response should match the significance</h2><p>Not every minor isolated issue requires a large investigation, but repeated, high-risk or systemic failures usually need deeper cause analysis.</p>\n<h2 id=\"closeout\">Closure requires verification</h2><p>Corrective action should be closed only after evidence shows the action was completed and, where appropriate, effective.</p>\n<h2 id=\"takeaway\">Practical takeaway</h2><p>Non-conformance identifies what went wrong. Correction fixes the immediate problem. Corrective action addresses why it happened and helps prevent recurrence.</p>\n<h2 id=\"references\">References</h2><ol><li><a href=\"https://www.iso.org/standard/62085.html\">ISO — ISO 9001:2015</a>.</li></ol>"
}
